arxiv_id,concept_iri,canonical_label,usage_context,extraction_rule
2606.18799v1,http://cll.niimm.ksu.ru/ontologies/mathematics#E1168,Line,"elements, but signal selection, pairing, interconnection, and tuning remain heuristic. Nonlinear model predictive control (NMPC) gives a systematic constrained-operation workflow, but requires a maintaine",MathEntRuler lexical concept match
2606.18799v1,http://cll.niimm.ksu.ru/ontologies/mathematics#E2271,Ring,"ectors, feedforward/override logic, and valve-position elements, but signal selection, pairing, interconnection, and tuning remain heuristic. Nonlinear model predictive control (NMPC) gives a systematic c",MathEntRuler lexical concept match
2606.18796v1,http://cll.niimm.ksu.ru/ontologies/mathematics#E847,Set,"results on well-filteredness of $T_0$-spaces For a $T_0$-space $X$, let $Q (X)$ be the poset of nonempty compact saturated sets of $X$ with the reverse inclusion order. The space $X$ is said to have pro",MathEntRuler lexical concept match
2606.18796v1,http://example.org/mathkg/Subset,Subset,"$\wedge K$ exists for any $K\in Q(X)$, and (2) for any filtered family $\{K_d : d\in D\}\subseteq Q(X)$ and $x\in X$, if $\bigvee^{\uparrow}_{d\in D}\bigwedge K_d$ exists and $x\not\leq \bigvee^{\uparrow}_",MathEntRuler lexical concept match
2606.18796v1,http://example.org/mathkg/Limit,Limit,"and $x\not\leq \bigvee^{\uparrow}_{d\in D}\bigwedge K_d$, then there is $\varphi\in \prod\limits_{d\in D}\!\!K_d$ and an upper bound $u$ of $\varphi(D)$ such that $x\not\leq u$. In this paper, we prove tha",MathEntRuler lexical concept match
2606.18794v1,http://cll.niimm.ksu.ru/ontologies/mathematics#E1301,Operation,"ations, regular triangulations, and quadratic triangulations are preserved under the join operation. As a byproduct, we state the necessary and sufficient condition for the Cartesian product of two Gorenstein",MathEntRuler lexical concept match
2606.18794v1,http://example.org/mathkg/Integer,Integer,"is not necessarily Ehrhart positive. Then we prove that if two lattice polytopes have the integer decomposition property and the spanning property, then their join also has these two properties. However, the",MathEntRuler lexical concept match
2606.18794v1,http://cll.niimm.ksu.ru/ontologies/mathematics#E1374,Join,"Ehrhart Theory of the Join of Two Lattice Polytopes Inspired by research on the Cartesian product of two lattice polytopes, this paper i",MathEntRuler lexical concept match
2606.18776v1,http://cll.niimm.ksu.ru/ontologies/mathematics#E2114,Number,On the crossing number of knots and links on surface in 3-manifolds We give a lower bound of the crossing number of knots and links,MathEntRuler lexical concept match
2606.18776v1,http://cll.niimm.ksu.ru/ontologies/mathematics#E2145,Group,ts and links projected on a 2-sided surface in a 3-manifold using the rank of fundamental groups.,MathEntRuler lexical concept match
2606.18770v1,http://cll.niimm.ksu.ru/ontologies/mathematics#E1891,Equation,Computing resonances of perturbed Schrödinger equations: Application to Reissner-Norsdtröm-de Sitter black holes We present a numerical method for computing resonan,MathEntRuler lexical concept match
2606.18770v1,http://cll.niimm.ksu.ru/ontologies/mathematics#E2106,Dimension,"dtröm-de Sitter black holes We present a numerical method for computing resonances of one-dimensional Schrödinger equations perturbed by a compactly supported potential, via finding zeros of the Wronskian asso",MathEntRuler lexical concept match
2606.18770v1,http://cll.niimm.ksu.ru/ontologies/mathematics#E449,Method,equations: Application to Reissner-Norsdtröm-de Sitter black holes We present a numerical method for computing resonances of one-dimensional Schrödinger equations perturbed by a compactly supported potentia,MathEntRuler lexical concept match
2606.18768v1,http://cll.niimm.ksu.ru/ontologies/mathematics#E847,Set,"lt moduli spaces. For $λ\in S^1$, we prove that, on any complex analytic subvariety $U\subset S$, the rescaled family $λ\cdotσ_{\mathrm{Dol}}|_U$ is again isomonodromic if $σ_{\mathrm{Dol}}|_U$ is holomo",MathEntRuler lexical concept match
2606.18768v1,http://example.org/mathkg/Subset,Subset,"eault moduli spaces. For $λ\in S^1$, we prove that, on any complex analytic subvariety $U\subset S$, the rescaled family $λ\cdotσ_{\mathrm{Dol}}|_U$ is again isomonodromic if $σ_{\mathrm{Dol}}|_U$ is holomo",MathEntRuler lexical concept match
2606.18768v1,http://cll.niimm.ksu.ru/ontologies/mathematics#E1380,Deformation,"Isomonodromic deformations, $\mathbb C^*$-actions, and characterization of non-abelian Noether-Lefschetz loci on Dolbeault moduli space",MathEntRuler lexical concept match
2606.18768v1,http://cll.niimm.ksu.ru/ontologies/mathematics#E1741,Theorem,"haracterization of Simpson's non-abelian Noether--Lefschetz locus firstly proved in \cite[Theorem 1.2]{HSJZ}. Namely, if the initial local system underlies a polarized complex variation of Hodge structures,",MathEntRuler lexical concept match
2606.18759v1,http://cll.niimm.ksu.ru/ontologies/mathematics#E449,Method,"rametric Surfaces The concept of geodesic-like curves was introduced by Chen in 2010 as a method for estimating shortest paths (geodesics) on parametric surfaces, with its convergence established theoretica",MathEntRuler lexical concept match
2606.18757v1,http://cll.niimm.ksu.ru/ontologies/mathematics#E1891,Equation,ew inverse spectral problem that consists in the recovery of the third-order differential equation from two spectra corresponding to the boundary conditions $y(0) = y(1) = y(2) = 0$ and $y(0) = y'(0) = y(1) =,MathEntRuler lexical concept match
2606.18757v1,http://cll.niimm.ksu.ru/ontologies/mathematics#E1703,Matrix,eneral approach that reconstructs higher-order differential operators from the Weyl-Yurko matrix.,MathEntRuler lexical concept match
2606.18757v1,http://cll.niimm.ksu.ru/ontologies/mathematics#E293,Point,"Third-order inverse spectral problem with the three-point boundary conditions In this paper, we study a new inverse spectral problem that consists in the recovery of t",MathEntRuler lexical concept match
2606.18757v1,http://cll.niimm.ksu.ru/ontologies/mathematics#E1885,Existence theorem,"ary conditions $y(0) = y(1) = y(2) = 0$ and $y(0) = y'(0) = y(1) = 0$. The uniqueness and existence theorems for the solution are obtained. To prove the results, we treat the inverse problem using a general approach t",MathEntRuler lexical concept match
2606.18757v1,http://cll.niimm.ksu.ru/ontologies/mathematics#E1741,Theorem,"ions $y(0) = y(1) = y(2) = 0$ and $y(0) = y'(0) = y(1) = 0$. The uniqueness and existence theorems for the solution are obtained. To prove the results, we treat the inverse problem using a general approach t",MathEntRuler lexical concept match
2606.18754v1,http://cll.niimm.ksu.ru/ontologies/mathematics#E2114,Number,"$(0,1)$ that never rises above the line $y=x$. These paths are enumerated by the Catalan numbers and play a central role in enumerative combinatorics. We color the cells of the integer grid in black and wh",MathEntRuler lexical concept match
2606.18754v1,http://example.org/mathkg/Integer,Integer,"n numbers and play a central role in enumerative combinatorics. We color the cells of the integer grid in black and white according to two natural patterns, namely chessboard and column-alternating, and enum",MathEntRuler lexical concept match
2606.18754v1,http://cll.niimm.ksu.ru/ontologies/mathematics#E1168,Line,"consisting of $n$ right-steps $(1,0)$ and $n$ up-steps $(0,1)$ that never rises above the line $y=x$. These paths are enumerated by the Catalan numbers and play a central role in enumerative combinatorics",MathEntRuler lexical concept match
2606.18752v1,http://cll.niimm.ksu.ru/ontologies/mathematics#E2452,Relation,"with respect to the random field strength, regardless of boundary conditions. Tasaki's correlation inequality for finite-dimensional spin glass models shows that the expectation of the squared replica overlap",MathEntRuler lexical concept match
2606.18752v1,http://example.org/mathkg/Equality,Equality,"t to the random field strength, regardless of boundary conditions. Tasaki's correlation inequality for finite-dimensional spin glass models shows that the expectation of the squared replica overlap is bounded",MathEntRuler lexical concept match
2606.18752v1,http://cll.niimm.ksu.ru/ontologies/mathematics#E1202,Inequality,"ect to the random field strength, regardless of boundary conditions. Tasaki's correlation inequality for finite-dimensional spin glass models shows that the expectation of the squared replica overlap is bounded",MathEntRuler lexical concept match
2606.18752v1,http://cll.niimm.ksu.ru/ontologies/mathematics#E2134,Constant,n in the Edwards-Anderson (EA) model under random field almost everywhere in the coupling constant space in any dimension. The EA order parameter is represented in terms of the derivative of the free energy d,MathEntRuler lexical concept match
2606.18752v1,http://example.org/mathkg/Derivative,Derivative,"ng constant space in any dimension. The EA order parameter is represented in terms of the derivative of the free energy density with respect to the random field strength, regardless of boundary conditions. Tasa",MathEntRuler lexical concept match
2606.18752v1,http://example.org/mathkg/Limit,Limit,able us to prove that the variance of the replica overlap vanishes in the infinite-volume limit. The self-averaging of the replica bond overlap is proven also in the EA model with Gaussian exchange interac,MathEntRuler lexical concept match
2606.18752v1,http://example.org/mathkg/Volume,Volume,ions enable us to prove that the variance of the replica overlap vanishes in the infinite-volume limit. The self-averaging of the replica bond overlap is proven also in the EA model with Gaussian exchange i,MathEntRuler lexical concept match
2606.18752v1,http://example.org/mathkg/Mean,Mean,ut random field. Short-range spin glass models have been shown to behave differently from mean-field spin glass models with RSB phase.,MathEntRuler lexical concept match
2606.18752v1,http://example.org/mathkg/Variance,Variance,d by the squared EA order parameter. These simple evaluations enable us to prove that the variance of the replica overlap vanishes in the infinite-volume limit. The self-averaging of the replica bond overlap,MathEntRuler lexical concept match
2606.18752v1,http://cll.niimm.ksu.ru/ontologies/mathematics#E2106,Dimension,son (EA) model under random field almost everywhere in the coupling constant space in any dimension. The EA order parameter is represented in terms of the derivative of the free energy density with respect to,MathEntRuler lexical concept match
2606.18740v1,http://cll.niimm.ksu.ru/ontologies/mathematics#E1741,Theorem,"ar emphasis on Kähler hyperbolic manifolds and bounded symmetric domains. We also discuss theorems regarding the upper bounds for the bottom of the spectrum under Ricci and bisectional curvature assumptions,",MathEntRuler lexical concept match
2606.18736v1,http://cll.niimm.ksu.ru/ontologies/mathematics#E847,Set,x representation acting on $\mathcal{H}\oplus\mathbb{C}$. We study the geometry of the subset $M(\mathcal{H})$ of $\mathcal{B}(\mathcal{H}\oplus\mathbb{C})$ consisting of these block operator matrices. I,MathEntRuler lexical concept match
2606.18736v1,http://example.org/mathkg/Subset,Subset,trix representation acting on $\mathcal{H}\oplus\mathbb{C}$. We study the geometry of the subset $M(\mathcal{H})$ of $\mathcal{B}(\mathcal{H}\oplus\mathbb{C})$ consisting of these block operator matrices. I,MathEntRuler lexical concept match
2606.18736v1,http://example.org/mathkg/Element,Element,{H}\oplus\mathbb{C})$ consisting of these block operator matrices. It is shown that every element corresponding to a non-rotation automorphism is a smooth point of $\mathcal{B}(\mathcal{H}\oplus\mathbb{C})$.,MathEntRuler lexical concept match
2606.18736v1,http://cll.niimm.ksu.ru/ontologies/mathematics#E1318,Multiplication,"satisfy a submultiplicativity under a certain composition rule other than usual operator multiplication, and induce a metric on certain subsets of $Aut(B)$ which recover the hyperbolic metric on the Hilbert ball.",MathEntRuler lexical concept match
2606.18736v1,http://cll.niimm.ksu.ru/ontologies/mathematics#E1703,Matrix,lbert space $\H\oplus \mathbb{C}$. Any member of $Aut(B)$ admits a natural block operator matrix representation acting on $\mathcal{H}\oplus\mathbb{C}$. We study the geometry of the subset $M(\mathcal{H})$,MathEntRuler lexical concept match
2606.18736v1,http://cll.niimm.ksu.ru/ontologies/mathematics#E293,Point,. It is shown that every element corresponding to a non-rotation automorphism is a smooth point of $\mathcal{B}(\mathcal{H}\oplus\mathbb{C})$. Orthogonality between two such matrices is characterized geome,MathEntRuler lexical concept match
2606.18736v1,http://cll.niimm.ksu.ru/ontologies/mathematics#E1168,Line,t ball $B$ of a complex Hilbert space $\H$ by representing each automorphism as a bounded linear operator on the augmented Hilbert space $\H\oplus \mathbb{C}$. Any member of $Aut(B)$ admits a natural bloc,MathEntRuler lexical concept match
2606.18736v1,http://cll.niimm.ksu.ru/ontologies/mathematics#E1405,Morphism,Operator Geometry of Hilbert Ball Automorphisms We consider the operator--theoretic model for the group of biholomorphic automorphisms $Aut(B)$ of the unit,MathEntRuler lexical concept match
2606.18736v1,http://cll.niimm.ksu.ru/ontologies/mathematics#E2145,Group,Geometry of Hilbert Ball Automorphisms We consider the operator--theoretic model for the group of biholomorphic automorphisms $Aut(B)$ of the unit ball $B$ of a complex Hilbert space $\H$ by representing,MathEntRuler lexical concept match
2606.18736v1,http://cll.niimm.ksu.ru/ontologies/mathematics#E3,Geometry,Operator Geometry of Hilbert Ball Automorphisms We consider the operator--theoretic model for the group of biholomorphic automo,MathEntRuler lexical concept match
2606.18730v1,http://cll.niimm.ksu.ru/ontologies/mathematics#E847,Set,") seeks a minimum cost trajectory for an agent that departs from a static depot, visits a set of moving targets, each within one of their assigned time windows, and returns to the depot. In this article,",MathEntRuler lexical concept match
2606.18730v1,http://example.org/mathkg/Integer,Integer,"of the MT-TSP where the agent trajectory must avoid moving obstacles. We present a Mixed-Integer Conic Programming (MICP) formulation that can be solved using off-the-shelf solvers, as well as a fast and sc",MathEntRuler lexical concept match
2606.18730v1,http://cll.niimm.ksu.ru/ontologies/mathematics#E1988,Formula,"ajectory must avoid moving obstacles. We present a Mixed-Integer Conic Programming (MICP) formulation that can be solved using off-the-shelf solvers, as well as a fast and scalable Two-Phase Bilevel Search (",MathEntRuler lexical concept match
2606.18730v1,http://cll.niimm.ksu.ru/ontologies/mathematics#E1168,Line,ty feasible solutions for the problem. We evaluate our approaches against an existing baseline algorithm on a broad range of problem instances with up to 40 targets and 40 obstacles. The results demonstra,MathEntRuler lexical concept match
2606.18730v1,http://cll.niimm.ksu.ru/ontologies/mathematics#E449,Method,"es with up to 40 targets and 40 obstacles. The results demonstrate that both the proposed methods significantly outperform the baseline with respect to success rates, solution costs, and computation time.",MathEntRuler lexical concept match
2606.18727v1,http://cll.niimm.ksu.ru/ontologies/mathematics#E1505,Function,"ete equivalence in the reflexive case. We apply our results to (vector-valued) continuous function spaces, which extends some earlier results and recovers few operator theoretical results with alternative pro",MathEntRuler lexical concept match
2606.18727v1,http://cll.niimm.ksu.ru/ontologies/mathematics#E1988,Formula,and the strictness of this gap is confirmed by counterexamples in $\ell_\infty^2$. A dual formulation of norming approximate orthogonality is established with a complete equivalence in the reflexive case. We,MathEntRuler lexical concept match
2606.18727v1,http://cll.niimm.ksu.ru/ontologies/mathematics#E1693,Vector,"s established with a complete equivalence in the reflexive case. We apply our results to (vector-valued) continuous function spaces, which extends some earlier results and recovers few operator theoretical",MathEntRuler lexical concept match
2606.18727v1,http://example.org/mathkg/Scalar,Scalar,\nperp y \iff \|x+λy\|\geq (1-δ)\|x\|-\frac{\varepsilon}{1-δ}\|λy\|~\qquad \forall ~\text{scalars}~λ. \] This framework interpolates between two notions of approximate orthogonality in normed linear spaces,MathEntRuler lexical concept match
2606.18727v1,http://cll.niimm.ksu.ru/ontologies/mathematics#E1168,Line,"Norming Approximate Orthogonality in Normed Linear Spaces We introduce and study the notion of \emph{norming approximate orthogonality}, a two-parameter gener",MathEntRuler lexical concept match
2606.18725v1,http://example.org/mathkg/Equality,Equality,"mental tensors of the submersion and the Riemannian map. Furthermore, we characterize the equality cases through precise algebraic conditions on the corresponding shape operators, providing their geometric in",MathEntRuler lexical concept match
2606.18725v1,http://cll.niimm.ksu.ru/ontologies/mathematics#E1324,Map,"Generalized Chen's inequalities for Riemannian submersions and Riemannian maps with Applications In this paper, we establish generalized B.-Y. Chen inequalities for Riemannian submersions",MathEntRuler lexical concept match
2606.18725v1,http://cll.niimm.ksu.ru/ontologies/mathematics#E2,Algebra,"n and the Riemannian map. Furthermore, we characterize the equality cases through precise algebraic conditions on the corresponding shape operators, providing their geometric interpretation. As applications,",MathEntRuler lexical concept match
2606.18724v1,http://cll.niimm.ksu.ru/ontologies/mathematics#E847,Set,"cal system with vanishing damping $α/t$, where $α\geq 3$. Under the merely convex-concave setting, we prove convergence of the primal-dual trajectory to a saddle point. In the noncritical regime $α>3$, w",MathEntRuler lexical concept match
2606.18724v1,http://cll.niimm.ksu.ru/ontologies/mathematics#E1315,Addition,"ed rate $o(1/t^{2})$ for the primal-dual gap and $o(1/t)$ for the velocity, and, under an additional Lipschitz gradient assumption, $o(1/t)$ for the stationarity residual. We then derive a structure-preservin",MathEntRuler lexical concept match
2606.18724v1,http://example.org/mathkg/Sequence,Sequence,"st primal-dual algorithm with Nesterov extrapolation. For a general accelerated parameter sequence ${t_k}$ satisfying $t_{k+1}^2-t_k^2\le ρt_{k+1}$ with $ρ\in(0,1]$, we prove the $O(1/t_k^{2})$ convergence ra",MathEntRuler lexical concept match
2606.18724v1,http://cll.niimm.ksu.ru/ontologies/mathematics#E293,Point,Fast primal-dual methods for convex-concave bilinear saddle point problems: continuous-time dynamics and discrete algorithms This paper studies Nesterov accelerated methods fo,MathEntRuler lexical concept match
2606.18724v1,http://cll.niimm.ksu.ru/ontologies/mathematics#E1168,Line,Fast primal-dual methods for convex-concave bilinear saddle point problems: continuous-time dynamics and discrete algorithms This paper studies Nesterov acceler,MathEntRuler lexical concept match
2606.18724v1,http://cll.niimm.ksu.ru/ontologies/mathematics#E449,Method,Fast primal-dual methods for convex-concave bilinear saddle point problems: continuous-time dynamics and discrete algorithms This pap,MathEntRuler lexical concept match
2606.18724v1,http://cll.niimm.ksu.ru/ontologies/mathematics#E1700,Gradient,"for the primal-dual gap and $o(1/t)$ for the velocity, and, under an additional Lipschitz gradient assumption, $o(1/t)$ for the stationarity residual. We then derive a structure-preserving finite-difference d",MathEntRuler lexical concept match
2606.18722v1,http://cll.niimm.ksu.ru/ontologies/mathematics#E1505,Function,"to $1$ as $t\rightarrow \infty$). Here we strengthen this bound by showing that, for any function $f:\mathbb{N}\mapsto \mathbb{N}$ that satisfies $f(t)\rightarrow \infty$ as $t\rightarrow \infty$, with high",MathEntRuler lexical concept match
2606.18722v1,http://cll.niimm.ksu.ru/ontologies/mathematics#E2114,Number,"dently) with probability proportional to their degrees. Let $ω(\mathbb{G})$ be the clique number of a graph $\mathbb{G}$, i.e.\ the number of vertices in a largest complete subgraph of $\mathbb{G}_{}$. Alve",MathEntRuler lexical concept match
2606.18722v1,http://cll.niimm.ksu.ru/ontologies/mathematics#E887,Graph,"Very large cliques in a scale-free random graph In this short article we consider a preferential attachment random graph model with edge steps, studied by Al",MathEntRuler lexical concept match
2606.18722v1,http://cll.niimm.ksu.ru/ontologies/mathematics#E2410,Probability,"o it, the model evolves as follows. At every subsequent (discrete) time step, either with probability $p$ we add a vertex to the graph and connect it to exactly one of the older vertices selected with probabilit",MathEntRuler lexical concept match
2606.18722v1,http://cll.niimm.ksu.ru/ontologies/mathematics#E1324,Map,"w \infty$). Here we strengthen this bound by showing that, for any function $f:\mathbb{N}\mapsto \mathbb{N}$ that satisfies $f(t)\rightarrow \infty$ as $t\rightarrow \infty$, with high probability \[ω(\m",MathEntRuler lexical concept match
2606.18718v1,http://cll.niimm.ksu.ru/ontologies/mathematics#E1505,Function,"oint, perfect spheres. We rigorously define the algebraic properties of this new distance function and demonstrate its consistency across various dimensions. Furthermore, we explore the structural characteris",MathEntRuler lexical concept match
2606.18718v1,http://example.org/mathkg/Limit,Limit,"acking problem was provided by Hamming via his well-known perfect codes. However, a major limitation of the traditional Hamming metric is its strict applicability, as it allows perfect partitioning only fo",MathEntRuler lexical concept match
2606.18718v1,http://cll.niimm.ksu.ru/ontologies/mathematics#E887,Graph,"a fundamental and complex problem with significant implications for coding theory, cryptography, and discrete mathematics. The classical solution to the perfect sphere packing problem was provided by Hamm",MathEntRuler lexical concept match
2606.18718v1,http://cll.niimm.ksu.ru/ontologies/mathematics#E2108,Distance,"rained dimensions. To address this structural limitation, this article introduces a novel distance metric specifically designed for Boolean hypercubes. The proposed metric modifies the topological properties",MathEntRuler lexical concept match
2606.18718v1,http://cll.niimm.ksu.ru/ontologies/mathematics#E2106,Dimension,"lity, as it allows perfect partitioning only for spaces with specific, highly constrained dimensions. To address this structural limitation, this article introduces a novel distance metric specifically designe",MathEntRuler lexical concept match
2606.18718v1,http://cll.niimm.ksu.ru/ontologies/mathematics#E2,Algebra,"space of any arbitrary dimension into disjoint, perfect spheres. We rigorously define the algebraic properties of this new distance function and demonstrate its consistency across various dimensions. Further",MathEntRuler lexical concept match
2606.18718v1,http://cll.niimm.ksu.ru/ontologies/mathematics#E1374,Join,"it mathematically viable to partition a Boolean space of any arbitrary dimension into disjoint, perfect spheres. We rigorously define the algebraic properties of this new distance function and demonstrat",MathEntRuler lexical concept match
2606.18700v1,http://cll.niimm.ksu.ru/ontologies/mathematics#E293,Point,his phenomenon to mean mixture curvature and discuss it from an information-geometric viewpoint.,MathEntRuler lexical concept match
2606.18700v1,http://example.org/mathkg/Mean,Mean,"der the resulting loss, the Bayesian predictive Lévy density is shown to be the posterior mean Lévy density. Unlike the normal and Poisson models, infinitesimal prediction in the Gamma model does not redu",MathEntRuler lexical concept match
2606.18695v1,http://example.org/mathkg/Element,Element,"of solutions in a three-dimensional domain. To support the theoretical analysis, a finite element method is developed for the numerical approximation of the system, and convergence studies based on mesh refi",MathEntRuler lexical concept match
2606.18695v1,http://cll.niimm.ksu.ru/ontologies/mathematics#E1891,Equation,driven fish--mussel ecosystem model described by a coupled system of partial differential equations subject to homogeneous Neumann boundary conditions. Under suitable assumptions on the system parameters and,MathEntRuler lexical concept match
2606.18695v1,http://cll.niimm.ksu.ru/ontologies/mathematics#E2145,Group,"d initial data, we establish the global existence of classical solutions by employing semigroup methods together with a priori estimates. We also examine the possible blow-up behavior of solutions in a thr",MathEntRuler lexical concept match
2606.18695v1,http://cll.niimm.ksu.ru/ontologies/mathematics#E2106,Dimension,"a priori estimates. We also examine the possible blow-up behavior of solutions in a three-dimensional domain. To support the theoretical analysis, a finite element method is developed for the numerical approxi",MathEntRuler lexical concept match
2606.18695v1,http://cll.niimm.ksu.ru/ontologies/mathematics#E449,Method,"ial data, we establish the global existence of classical solutions by employing semigroup methods together with a priori estimates. We also examine the possible blow-up behavior of solutions in a three-dime",MathEntRuler lexical concept match
