arxiv_id,concept_iri,canonical_label,usage_context,extraction_rule
2606.18498v1,http://cll.niimm.ksu.ru/ontologies/mathematics#E1316,Reduction,"nk-two geometry associated with pairs of non-diagonal components. We establish a rank-two reduction theorem, derive explicit trace and determinant formulas for the corresponding operators, and obtain a classif",MathEntRuler lexical concept match
2606.18498v1,http://cll.niimm.ksu.ru/ontologies/mathematics#E2,Algebra,dence Correspondences and Nonlinear Root Geometry We show that finite morphisms of smooth algebraic varieties naturally give rise to Cartan--Coxeter type structures. Starting from the self-fiber product $X\t,MathEntRuler lexical concept match
2606.18498v1,http://cll.niimm.ksu.ru/ontologies/mathematics#E3,Geometry,Coincidence Correspondences and Nonlinear Root Geometry We show that finite morphisms of smooth algebraic varieties naturally give rise to Cartan--Coxeter type struc,MathEntRuler lexical concept match
2606.18498v1,http://cll.niimm.ksu.ru/ontologies/mathematics#E1741,Theorem,"metry associated with pairs of non-diagonal components. We establish a rank-two reduction theorem, derive explicit trace and determinant formulas for the corresponding operators, and obtain a classification",MathEntRuler lexical concept match
2606.18476v1,http://cll.niimm.ksu.ru/ontologies/mathematics#E1988,Formula,"rove a fixed finite-window structural theorem for sharp localized Navier-Stokes packages, formulated as both a local-to-clean detection theorem and an anti-phantom principle. The result addresses whether a d",MathEntRuler lexical concept match
2606.18476v1,http://cll.niimm.ksu.ru/ontologies/mathematics#E1703,Matrix,"ce for the imported quotient interface, finite-dimensional pressure-tail models, explicit matrix realizations of the structural inputs, NS-generated coordinate realizability, compactness criteria for clean",MathEntRuler lexical concept match
2606.18476v1,http://cll.niimm.ksu.ru/ontologies/mathematics#E1168,Line,"m and an anti-phantom principle. The result addresses whether a defect visible in the baseline quotient geometry can disappear after pressure-tail enrichment, residual transfer, quotienting, and clean-to-",MathEntRuler lexical concept match
2606.18476v1,http://cll.niimm.ksu.ru/ontologies/mathematics#E2106,Dimension,"and residual-cheap. We also record provenance for the imported quotient interface, finite-dimensional pressure-tail models, explicit matrix realizations of the structural inputs, NS-generated coordinate realiz",MathEntRuler lexical concept match
2606.18476v1,http://cll.niimm.ksu.ru/ontologies/mathematics#E1317,Comparison,"ter pressure-tail enrichment, residual transfer, quotienting, and clean-to-local detector comparison. Under synchronized representatives, baseline-to-tail visibility, component comparison, residual-ledger closu",MathEntRuler lexical concept match
2606.18476v1,http://cll.niimm.ksu.ru/ontologies/mathematics#E3,Geometry,"phantom principle. The result addresses whether a defect visible in the baseline quotient geometry can disappear after pressure-tail enrichment, residual transfer, quotienting, and clean-to-local detector com",MathEntRuler lexical concept match
2606.18476v1,http://cll.niimm.ksu.ru/ontologies/mathematics#E1741,Theorem,"ntom Detection for Sharp Navier-Stokes Packages We prove a fixed finite-window structural theorem for sharp localized Navier-Stokes packages, formulated as both a local-to-clean detection theorem and an anti",MathEntRuler lexical concept match
2606.18475v1,http://cll.niimm.ksu.ru/ontologies/mathematics#E1505,Function,"ng inverse and Markov-chain transformations, which represent the follower's response as a function of the leader's decision and exogenous randomness. We handle the T-I-BO's uncertainty via sample-average appr",MathEntRuler lexical concept match
2606.18475v1,http://cll.niimm.ksu.ru/ontologies/mathematics#E1988,Formula,"ogenous measures, including the special case of strong-weak decision-dependent I-BO. We reformulate the I-BO as a Transformed I-BO (T-I-BO) with exogenous uncertainty by defining inverse and Markov-chain tra",MathEntRuler lexical concept match
2606.18475v1,http://cll.niimm.ksu.ru/ontologies/mathematics#E2410,Probability,"ere the follower's selected optimal response is a decision-dependent random event, with a probability measure influenced by the leader's decision. We formally introduce a class of such endogenous measures, inclu",MathEntRuler lexical concept match
2606.18475v1,http://cll.niimm.ksu.ru/ontologies/mathematics#E449,Method,"proaches for its SAA program according to the chosen transformation. Computationally, our methods solve reasonable-sized instances efficiently and outperform the deterministic equivalent when available. Fur",MathEntRuler lexical concept match
2606.18474v1,http://cll.niimm.ksu.ru/ontologies/mathematics#E847,Set,"Tuples as sets In 1921, Kuratowski gave the now-standard definition of ordered pair in the context of set theory. This pape",MathEntRuler lexical concept match
2606.18470v1,http://example.org/mathkg/Element,Element,"the first such solutions in any external potential. Remarkably, one family comprises only elementary functions whose longitudinal profiles reproduce the free-Schrödinger Hermite--Gauss wave packets in the no",MathEntRuler lexical concept match
2606.18470v1,http://cll.niimm.ksu.ru/ontologies/mathematics#E1505,Function,"uch solutions in any external potential. Remarkably, one family comprises only elementary functions whose longitudinal profiles reproduce the free-Schrödinger Hermite--Gauss wave packets in the nonrelativisti",MathEntRuler lexical concept match
2606.18470v1,http://cll.niimm.ksu.ru/ontologies/mathematics#E1891,Equation,"tial We construct exact, positive-energy, normalizable wave-packet solutions of the Dirac equation in the axisymmetric potential $V=-\,v_0/ρ$ -- to our knowledge, the first such solutions in any external pote",MathEntRuler lexical concept match
2606.18470v1,http://example.org/mathkg/Limit,Limit,rofiles reproduce the free-Schrödinger Hermite--Gauss wave packets in the nonrelativistic limit. All packets share two striking features: (i) a probability density that is pointwise decoupled from spin ori,MathEntRuler lexical concept match
2606.18470v1,http://cll.niimm.ksu.ru/ontologies/mathematics#E293,Point,ivistic limit. All packets share two striking features: (i) a probability density that is pointwise decoupled from spin orientation -- despite the inherent spin-orbit coupling of the Dirac equation -- and,MathEntRuler lexical concept match
2606.18470v1,http://cll.niimm.ksu.ru/ontologies/mathematics#E2410,Probability,wave packets in the nonrelativistic limit. All packets share two striking features: (i) a probability density that is pointwise decoupled from spin orientation -- despite the inherent spin-orbit coupling of the,MathEntRuler lexical concept match
2606.18470v1,http://cll.niimm.ksu.ru/ontologies/mathematics#E2105,Orientation,re two striking features: (i) a probability density that is pointwise decoupled from spin orientation -- despite the inherent spin-orbit coupling of the Dirac equation -- and (ii) a complete freezing of their ti,MathEntRuler lexical concept match
2606.18470v1,http://cll.niimm.ksu.ru/ontologies/mathematics#E1368,Orbit,ty density that is pointwise decoupled from spin orientation -- despite the inherent spin-orbit coupling of the Dirac equation -- and (ii) a complete freezing of their time evolution at the critical coupli,MathEntRuler lexical concept match
2606.18470v1,http://cll.niimm.ksu.ru/ontologies/mathematics#E1324,Map,volution at the critical coupling $v_0\to\hbar c/2$. We also present a simple scheme that maps solutions of the 2D Helmholtz equation to further exact Dirac wave packets.,MathEntRuler lexical concept match
2606.18463v1,http://cll.niimm.ksu.ru/ontologies/mathematics#E847,Set,synchronization points. Modern GPUs with matrix hardware and reduced-precision formats offset this by accelerating the Gram GEMM and shrinking BF16 traffic. We study mixed-precision CA-SGD for generalize,MathEntRuler lexical concept match
2606.18463v1,http://cll.niimm.ksu.ru/ontologies/mathematics#E1703,Matrix,"by replacing $s$ consecutive AllReduces with a single AllReduce of an $sb\times sb$ Gram matrix, trading more computation and bandwidth for fewer synchronization points. Modern GPUs with matrix hardware an",MathEntRuler lexical concept match
2606.18463v1,http://cll.niimm.ksu.ru/ontologies/mathematics#E1693,Vector,"ansfer in principle across GPU generations. The recipe stores the input matrix and margin vector in low precision, computes the Gram matrix from low-precision inputs with high-precision accumulation, commun",MathEntRuler lexical concept match
2606.18463v1,http://example.org/mathkg/Limit,Limit,"GD for Generalized Linear Models on GPUs Distributed stochastic gradient descent (SGD) is limited by communication rather than computation, since each iteration requires an AllReduce across processes. Comm",MathEntRuler lexical concept match
2606.18463v1,http://cll.niimm.ksu.ru/ontologies/mathematics#E293,Point,"b\times sb$ Gram matrix, trading more computation and bandwidth for fewer synchronization points. Modern GPUs with matrix hardware and reduced-precision formats offset this by accelerating the Gram GEMM an",MathEntRuler lexical concept match
2606.18463v1,http://cll.niimm.ksu.ru/ontologies/mathematics#E1168,Line,Mixed-Precision Communication-Avoiding SGD for Generalized Linear Models on GPUs Distributed stochastic gradient descent (SGD) is limited by communication rather than comput,MathEntRuler lexical concept match
2606.18463v1,http://cll.niimm.ksu.ru/ontologies/mathematics#E1700,Gradient,"n Communication-Avoiding SGD for Generalized Linear Models on GPUs Distributed stochastic gradient descent (SGD) is limited by communication rather than computation, since each iteration requires an AllReduce",MathEntRuler lexical concept match
2606.18462v1,http://cll.niimm.ksu.ru/ontologies/mathematics#E847,Set,"hether for every k >= 4 there is a k-vertex-critical graph without critical edges; Jensen settled all k >= 5, and only k=4 remains open. Following Skottova and Steiner, call a graph G a (4,1)-graph if ch",MathEntRuler lexical concept match
2606.18462v1,http://cll.niimm.ksu.ru/ontologies/mathematics#E887,Graph,"c's k=4 problem Dirac asked in 1970 whether for every k >= 4 there is a k-vertex-critical graph without critical edges; Jensen settled all k >= 5, and only k=4 remains open. Following Skottova and Steiner,",MathEntRuler lexical concept match
2606.18462v1,http://cll.niimm.ksu.ru/ontologies/mathematics#E1405,Morphism,"-regular 4-vertex-critical graph on n <= 15 vertices, except for a unique graph (up to isomorphism) on n=13, whose 13 critical edges form a Hamilton cycle; hence any 6-regular (4,1)-graph has at least 16 vert",MathEntRuler lexical concept match
2606.18462v1,http://cll.niimm.ksu.ru/ontologies/mathematics#E1383,Isomorphism,"o 6-regular 4-vertex-critical graph on n <= 15 vertices, except for a unique graph (up to isomorphism) on n=13, whose 13 critical edges form a Hamilton cycle; hence any 6-regular (4,1)-graph has at least 16 vert",MathEntRuler lexical concept match
2606.18462v1,http://cll.niimm.ksu.ru/ontologies/mathematics#E2271,Ring,"concentrated on two vertices forces them to receive equal colours in every proper 3-colouring. The proof of Theorem B rests on an exact classification of the 3x3 cut matrices of 6-edge-cuts in (4,1)-grap",MathEntRuler lexical concept match
2606.18462v1,http://cll.niimm.ksu.ru/ontologies/mathematics#E1741,Theorem,"whether a 6-regular (4,1)-graph exists. We prove three results about this 6-regular case. Theorem A (computational): there is no 6-regular 4-vertex-critical graph on n <= 15 vertices, except for a unique gra",MathEntRuler lexical concept match
2606.18458v1,http://cll.niimm.ksu.ru/ontologies/mathematics#E847,Set,"ive $α$-stable random variable with Laplace transform $\mathbb{E}\exp(-uS_α)=\exp(-u^α)$, set $W_0=S_α^{-b}$, let $W$ be the $W_0$-size-biased version of $W_0$, and define $V_{p,q}=2^{a-b}W$. Then $X_p\s",MathEntRuler lexical concept match
2606.18458v1,http://cll.niimm.ksu.ru/ontologies/mathematics#E1505,Function,"p,q}X_q$. For $p>q$, the required Mellin quotient, viewed as the candidate characteristic function of $\log V$, is unbounded by Stirling's formula, and hence cannot be a characteristic function. The factor la",MathEntRuler lexical concept match
2606.18458v1,http://example.org/mathkg/Variable,Variable,"ussian laws Let $X_r\sim N_r(0,1)$ be the centered unit-scale generalized Gaussian random variable with density proportional to $\exp(-|x|^r/2)$. We prove that, for $p,q>0$, there exists a strictly positive r",MathEntRuler lexical concept match
2606.18458v1,http://cll.niimm.ksu.ru/ontologies/mathematics#E1988,Formula,", viewed as the candidate characteristic function of $\log V$, is unbounded by Stirling's formula, and hence cannot be a characteristic function. The factor laws form a multiplicative cocycle, $V_{p,r}\stack",MathEntRuler lexical concept match
2606.18458v1,http://cll.niimm.ksu.ru/ontologies/mathematics#E2410,Probability,Fourier--Mellin candidate density in the remaining $p<q$ branch is a genuine nonnegative probability density. The known Gaussian-base and bounded-parameter product cases are recovered as parts of a single posit,MathEntRuler lexical concept match
2606.18452v1,http://cll.niimm.ksu.ru/ontologies/mathematics#E2452,Relation,ty as finite Laurent sums of Voros exponentials. Tropicalizing these formulae and the NRS relations gives a chamberwise integer affine linear system for the leading logarithms of the NRS coordinates. In chamb,MathEntRuler lexical concept match
2606.18452v1,http://example.org/mathkg/Integer,Integer,oros exponentials. Tropicalizing these formulae and the NRS relations gives a chamberwise integer affine linear system for the leading logarithms of the NRS coordinates. In chambers where this system is unim,MathEntRuler lexical concept match
2606.18452v1,http://cll.niimm.ksu.ru/ontologies/mathematics#E1988,Formula,"y-Shatashvili Darboux coordinates. Using exact Wentzel-Kramers-Brillouin (WKB) connection formulae, we express the trace coordinates of the corresponding SL_2(C) character variety as finite Laurent sums of V",MathEntRuler lexical concept match
2606.18452v1,http://example.org/mathkg/Limit,Limit,"totics of NRS coordinates for opers in $SU(2)$, $N_f=4$ theory We study the semiclassical limit of SL_2-opers on the four-punctured sphere in Nekrasov-Rosly-Shatashvili Darboux coordinates. Using exact Wen",MathEntRuler lexical concept match
2606.18452v1,http://example.org/mathkg/Logarithm,Logarithm,ae and the NRS relations gives a chamberwise integer affine linear system for the leading logarithms of the NRS coordinates. In chambers where this system is unimodular and the selected cycles form a primitive,MathEntRuler lexical concept match
2606.18452v1,http://cll.niimm.ksu.ru/ontologies/mathematics#E1168,Line,ls. Tropicalizing these formulae and the NRS relations gives a chamberwise integer affine linear system for the leading logarithms of the NRS coordinates. In chambers where this system is unimodular and t,MathEntRuler lexical concept match
2606.18452v1,http://cll.niimm.ksu.ru/ontologies/mathematics#E1741,Theorem,chamber and in the weak-coupling degeneration. No global coordinate-independent recovery theorem is claimed; non-unimodular or degenerate chambers are treated as limitations of the chosen NRS chart. In the,MathEntRuler lexical concept match
2606.18452v1,http://cll.niimm.ksu.ru/ontologies/mathematics#E1740,Connection form,"krasov-Rosly-Shatashvili Darboux coordinates. Using exact Wentzel-Kramers-Brillouin (WKB) connection formulae, we express the trace coordinates of the corresponding SL_2(C) character variety as finite Laurent sums o",MathEntRuler lexical concept match
2606.18450v1,http://cll.niimm.ksu.ru/ontologies/mathematics#E2452,Relation,"es irrotational fluid motion in both layers separately, and further obtain the dispersion relation which determines the phase speeds of propagating surface and internal waves. We prove a result on solutions t",MathEntRuler lexical concept match
2606.18450v1,http://cll.niimm.ksu.ru/ontologies/mathematics#E2134,Constant,"uatorial internal waves. A model of two vertically stratified fluid layers with different constant densities is employed. Taking Coriolis forces into account, we derive explicit solutions to the linearized go",MathEntRuler lexical concept match
2606.18450v1,http://cll.niimm.ksu.ru/ontologies/mathematics#E1891,Equation,"ng Coriolis forces into account, we derive explicit solutions to the linearized governing equations which assumes irrotational fluid motion in both layers separately, and further obtain the dispersion relatio",MathEntRuler lexical concept match
2606.18450v1,http://cll.niimm.ksu.ru/ontologies/mathematics#E1168,Line,"ies is employed. Taking Coriolis forces into account, we derive explicit solutions to the linearized governing equations which assumes irrotational fluid motion in both layers separately, and further obta",MathEntRuler lexical concept match
2606.18450v1,http://cll.niimm.ksu.ru/ontologies/mathematics#E1361,Motion,"explicit solutions to the linearized governing equations which assumes irrotational fluid motion in both layers separately, and further obtain the dispersion relation which determines the phase speeds of pr",MathEntRuler lexical concept match
2606.18445v1,http://cll.niimm.ksu.ru/ontologies/mathematics#E2129,Coefficient,A spectral based coefficient of determination for the fit of an MA(q) model We develop a spectral based coefficient of determination to me,MathEntRuler lexical concept match
2606.18440v1,http://cll.niimm.ksu.ru/ontologies/mathematics#E847,Set,"works, together with their realization maps and associated affine neurovarieties. In this setting we define morphisms, subnetworks, symmetry groups and quotient parameter spaces and we discuss geometric",MathEntRuler lexical concept match
2606.18440v1,http://cll.niimm.ksu.ru/ontologies/mathematics#E1505,Function,"egenerations We study the geometry of polynomial neural networks with monomial activation functions and no bias. We introduce a general framework of algebraic networks, together with their realization maps an",MathEntRuler lexical concept match
2606.18440v1,http://example.org/mathkg/Polynomial,Polynomial,Algebraic Networks and Architectural Degenerations We study the geometry of polynomial neural networks with monomial activation functions and no bias. We introduce a general framework of algebraic,MathEntRuler lexical concept match
2606.18440v1,http://example.org/mathkg/Scalar,Scalar,"hidden neuron. We prove that, for fully connected networks with non-increasing widths and scalar output, full parameters give smooth points of the corresponding neurovariety under explicit layerwise regular",MathEntRuler lexical concept match
2606.18440v1,http://cll.niimm.ksu.ru/ontologies/mathematics#E293,Point,"nected networks with non-increasing widths and scalar output, full parameters give smooth points of the corresponding neurovariety under explicit layerwise regularity assumptions. In particular, for these",MathEntRuler lexical concept match
2606.18440v1,http://cll.niimm.ksu.ru/ontologies/mathematics#E1405,Morphism,"th their realization maps and associated affine neurovarieties. In this setting we define morphisms, subnetworks, symmetry groups and quotient parameter spaces and we discuss geometric notions of identifiabil",MathEntRuler lexical concept match
2606.18440v1,http://cll.niimm.ksu.ru/ontologies/mathematics#E2145,Group,"ociated affine neurovarieties. In this setting we define morphisms, subnetworks, symmetry groups and quotient parameter spaces and we discuss geometric notions of identifiability and reducibility. Our main",MathEntRuler lexical concept match
2606.18440v1,http://cll.niimm.ksu.ru/ontologies/mathematics#E1324,Map,". We introduce a general framework of algebraic networks, together with their realization maps and associated affine neurovarieties. In this setting we define morphisms, subnetworks, symmetry groups and",MathEntRuler lexical concept match
2606.18440v1,http://cll.niimm.ksu.ru/ontologies/mathematics#E2,Algebra,Algebraic Networks and Architectural Degenerations We study the geometry of polynomial neural networks with monomial,MathEntRuler lexical concept match
2606.18440v1,http://cll.niimm.ksu.ru/ontologies/mathematics#E3,Geometry,Algebraic Networks and Architectural Degenerations We study the geometry of polynomial neural networks with monomial activation functions and no bias. We introduce a general framewor,MathEntRuler lexical concept match
2606.18438v1,http://cll.niimm.ksu.ru/ontologies/mathematics#E847,Set,"n In this paper, we study a sequential workforce management problem in a contingent labor setting with uncertainty in both worker production and labor supply. A firm seeks to maximize cumulative profit b",MathEntRuler lexical concept match
2606.18438v1,http://cll.niimm.ksu.ru/ontologies/mathematics#E1301,Operation,"eam of fixed size while learning worker productivity over time. We emphasize two critical operational frictions in this problem: replacing workers is costly, and workers may not be available immediately for hi",MathEntRuler lexical concept match
2606.18438v1,http://cll.niimm.ksu.ru/ontologies/mathematics#E1988,Formula,"r onboarding procedures. Thus, hiring decisions take effect only after a random delay. We formulate this problem as a stochastic multi-play bandit with costly switching and delayed actions, and develop a lea",MathEntRuler lexical concept match
2606.18438v1,http://cll.niimm.ksu.ru/ontologies/mathematics#E2271,Ring,"Sequential Hiring of Contingent Workers Through Learning-Based Optimization In this paper, we study a sequential workforce mana",MathEntRuler lexical concept match
2606.18434v1,http://cll.niimm.ksu.ru/ontologies/mathematics#E1988,Formula,"The Mañé-Freire formula holds for magnetic flows In this paper, we use the recently introduced notation and terminology for magnetic",MathEntRuler lexical concept match
2606.18434v1,http://example.org/mathkg/Sequence,Sequence,"etic analogue of the classical Freire--Mañé theorem and obtain some applications. As a consequence, we show that for an energy level of a magnetic system without focal points, either the metric entropy is pos",MathEntRuler lexical concept match
2606.18434v1,http://cll.niimm.ksu.ru/ontologies/mathematics#E293,Point,"ns. As a consequence, we show that for an energy level of a magnetic system without focal points, either the metric entropy is positive or the magnetic curvature is identically zero.",MathEntRuler lexical concept match
2606.18434v1,http://cll.niimm.ksu.ru/ontologies/mathematics#E1741,Theorem,"gnetic flows. In this context, we prove a magnetic analogue of the classical Freire--Mañé theorem and obtain some applications. As a consequence, we show that for an energy level of a magnetic system without",MathEntRuler lexical concept match
2606.18433v1,http://cll.niimm.ksu.ru/ontologies/mathematics#E1891,Equation,On a class of reflected McKean-Vlasov Stochastic Differential Equations with jumps This paper investigates a class of reflected McKean-Vlasov Stochastic Differential Equations driv,MathEntRuler lexical concept match
2606.18433v1,http://cll.niimm.ksu.ru/ontologies/mathematics#E1361,Motion,lass of reflected McKean-Vlasov Stochastic Differential Equations driven by both Brownian motion and a compensated Poisson random measure. We establish the existence and uniqueness of solutions and provide,MathEntRuler lexical concept match
2606.18414v1,http://cll.niimm.ksu.ru/ontologies/mathematics#E2145,Group,ce part of Hall's theorem for finite skew braces with soluble additive and multiplicative groups.,MathEntRuler lexical concept match
2606.18414v1,http://cll.niimm.ksu.ru/ontologies/mathematics#E2195,Multiplicative group,of the existence part of Hall's theorem for finite skew braces with soluble additive and multiplicative groups.,MathEntRuler lexical concept match
2606.18414v1,http://cll.niimm.ksu.ru/ontologies/mathematics#E1741,Theorem,"Analogues of Sylow's first theorem, Cauchy's theorem, and Hall's theorem for skew braces We establish an unconditional analogue of Sylow's first",MathEntRuler lexical concept match
2606.18411v1,http://cll.niimm.ksu.ru/ontologies/mathematics#E1301,Operation,"the thin QR factorization of tall-and-skinny matrices on GPUs, relying entirely on BLAS-3 operations. However, it is numerically unstable: forming the Gram matrix squares the condition number, causing breakdow",MathEntRuler lexical concept match
2606.18411v1,http://cll.niimm.ksu.ru/ontologies/mathematics#E2114,Number,"tions. However, it is numerically unstable: forming the Gram matrix squares the condition number, causing breakdown when $κ_2(\boldsymbol{A}) \gtrsim 10^8$. We present MRCQR (Mixed-Precision Randomized Chol",MathEntRuler lexical concept match
2606.18411v1,http://cll.niimm.ksu.ru/ontologies/mathematics#E1703,Matrix,"ying entirely on BLAS-3 operations. However, it is numerically unstable: forming the Gram matrix squares the condition number, causing breakdown when $κ_2(\boldsymbol{A}) \gtrsim 10^8$. We present MRCQR (Mi",MathEntRuler lexical concept match
2606.18411v1,http://example.org/mathkg/Limit,Limit,"RCQR (Mixed-Precision Randomized Cholesky-QR), a stable GPU algorithm that addresses this limitation. MRCQR uses a subsampled randomized trigonometric transform to construct a preconditioner $\boldsymbol{R",MathEntRuler lexical concept match
