arxiv_id,concept_iri,canonical_label,usage_context,extraction_rule
2606.19332v1,http://cll.niimm.ksu.ru/ontologies/mathematics#E1301,Operation,"and a general decision-support framework for integrated rescheduling problems in complex operations, with potential applications in logistics, transportation, and beyond.",MathEntRuler lexical concept match
2606.19332v1,http://cll.niimm.ksu.ru/ontologies/mathematics#E1315,Addition,"equential recovery, we consider these recovery phases from an integration perspective. In addition, we incorporate cruise speed control to enhance the recovery performance. While using flight copies is a comm",MathEntRuler lexical concept match
2606.19332v1,http://cll.niimm.ksu.ru/ontologies/mathematics#E2114,Number,"lting integrated mathematical model is challenging to solve in real time due to the large number of flight copies, especially when considering cruise speed control. This paper introduces a new sparse-dense",MathEntRuler lexical concept match
2606.19332v1,http://cll.niimm.ksu.ru/ontologies/mathematics#E1168,Line,"Sparse-dense flight copy-based interactive mechanism to airline integrated with cruise speed control Flight recovery, aircraft rerouting, and passenger reallocation are crit",MathEntRuler lexical concept match
2606.19332v1,http://cll.niimm.ksu.ru/ontologies/mathematics#E449,Method,"trol to enhance the recovery performance. While using flight copies is a common modelling method in airline disruption management, the resulting integrated mathematical model is challenging to solve in real",MathEntRuler lexical concept match
2606.19332v1,http://cll.niimm.ksu.ru/ontologies/mathematics#E2271,Ring,"ng to solve in real time due to the large number of flight copies, especially when considering cruise speed control. This paper introduces a new sparse-dense flight copy approach and proposes an innovativ",MathEntRuler lexical concept match
2606.19326v1,http://example.org/mathkg/Expression,Expression,ty and uniqueness are thence established based on the qualitative theory. The closed-form expressions reported here are also useful in the study of non-linear counterparts.,MathEntRuler lexical concept match
2606.19326v1,http://cll.niimm.ksu.ru/ontologies/mathematics#E1988,Formula,"re fully non-homogeneous initial-boundary-value problems for the celebrated Dirac system, formulated on the spatial half-line. Analytical solution formulae are derived formally via suitable implementation of",MathEntRuler lexical concept match
2606.19326v1,http://example.org/mathkg/Integral,Integral,stantial task relies on complex-analytic tools and careful interpretation of the obtained integral representations. These valid solutions are then used for investigating qualitative properties. These include,MathEntRuler lexical concept match
2606.19326v1,http://cll.niimm.ksu.ru/ontologies/mathematics#E1168,Line,"l-boundary-value problems for the celebrated Dirac system, formulated on the spatial half-line. Analytical solution formulae are derived formally via suitable implementation of the well-known Fokas' unifi",MathEntRuler lexical concept match
2606.19326v1,http://cll.niimm.ksu.ru/ontologies/mathematics#E449,Method,"e derived formally via suitable implementation of the well-known Fokas' unified transform methodology, and rigorously verified a posteriori. The latter substantial task relies on complex-analytic tools and",MathEntRuler lexical concept match
2606.19322v1,http://cll.niimm.ksu.ru/ontologies/mathematics#E2145,Group,Existential Inclusions of Bi-exact Groups are Conjugacy Representation Rigid If $Λ$ is a non-amenable bi-exact group and $Λ\hookrightarrow Γ$ is an ex,MathEntRuler lexical concept match
2606.19322v1,http://cll.niimm.ksu.ru/ontologies/mathematics#E1349,Embedding,"Rigid If $Λ$ is a non-amenable bi-exact group and $Λ\hookrightarrow Γ$ is an existential embedding, then each of the intersections $Λ\cap g Λg^{-1}$ for $g$ a member of $Γ\backslash Λ$ is amenable. This in co",MathEntRuler lexical concept match
2606.19322v1,http://cll.niimm.ksu.ru/ontologies/mathematics#E1310,Intersection,"ble bi-exact group and $Λ\hookrightarrow Γ$ is an existential embedding, then each of the intersections $Λ\cap g Λg^{-1}$ for $g$ a member of $Γ\backslash Λ$ is amenable. This in conjunction with work of Bekka an",MathEntRuler lexical concept match
2606.19313v1,http://cll.niimm.ksu.ru/ontologies/mathematics#E847,Set,extending classic Khintchine-type inequalities and yielding new results in the log-convex setting. We also investigate the stability of our inequalities. Our first stability inequality sharpens the class,MathEntRuler lexical concept match
2606.19313v1,http://example.org/mathkg/Equality,Equality,"vex setting. We also investigate the stability of our inequalities. Our first stability inequality sharpens the classic inequality by a deviation of the coefficient vector from the coordinate extremizers, whi",MathEntRuler lexical concept match
2606.19313v1,http://cll.niimm.ksu.ru/ontologies/mathematics#E1202,Inequality,"onvex setting. We also investigate the stability of our inequalities. Our first stability inequality sharpens the classic inequality by a deviation of the coefficient vector from the coordinate extremizers, whi",MathEntRuler lexical concept match
2606.19313v1,http://example.org/mathkg/Integer,Integer,"/(2k)!$ implies sharp comparisons between the $L_p$ and $L_2$ norms of $S$ for every even integer $p\geq 2$, extending classic Khintchine-type inequalities and yielding new results in the log-convex setting.",MathEntRuler lexical concept match
2606.19313v1,http://example.org/mathkg/Variable,Variable,lities for the weighted sums $S=\sum_ka_kX_k$ of independent copies of a symmetric random variable $X$. We show how log-monotonicity of the sequence $r_k(X)=k! \mathbb{E}[X^{2k}]/(2k)!$ implies sharp comparis,MathEntRuler lexical concept match
2606.19313v1,http://cll.niimm.ksu.ru/ontologies/mathematics#E2129,Coefficient,"ies. Our first stability inequality sharpens the classic inequality by a deviation of the coefficient vector from the coordinate extremizers, while the second quantifies deviation from the Gaussian limit. Our re",MathEntRuler lexical concept match
2606.19313v1,http://cll.niimm.ksu.ru/ontologies/mathematics#E1693,Vector,"st stability inequality sharpens the classic inequality by a deviation of the coefficient vector from the coordinate extremizers, while the second quantifies deviation from the Gaussian limit. Our results r",MathEntRuler lexical concept match
2606.19313v1,http://example.org/mathkg/Limit,Limit,"from the coordinate extremizers, while the second quantifies deviation from the Gaussian limit. Our results recover recent stability inequalities for random signs and apply to a broad class of distributio",MathEntRuler lexical concept match
2606.19313v1,http://example.org/mathkg/Sequence,Sequence,ndependent copies of a symmetric random variable $X$. We show how log-monotonicity of the sequence $r_k(X)=k! \mathbb{E}[X^{2k}]/(2k)!$ implies sharp comparisons between the $L_p$ and $L_2$ norms of $S$ for e,MathEntRuler lexical concept match
2606.19313v1,http://cll.niimm.ksu.ru/ontologies/mathematics#E2122,Even integer,"{2k}]/(2k)!$ implies sharp comparisons between the $L_p$ and $L_2$ norms of $S$ for every even integer $p\geq 2$, extending classic Khintchine-type inequalities and yielding new results in the log-convex setting.",MathEntRuler lexical concept match
2606.19313v1,http://cll.niimm.ksu.ru/ontologies/mathematics#E1317,Comparison,"w how log-monotonicity of the sequence $r_k(X)=k! \mathbb{E}[X^{2k}]/(2k)!$ implies sharp comparisons between the $L_p$ and $L_2$ norms of $S$ for every even integer $p\geq 2$, extending classic Khintchine-type",MathEntRuler lexical concept match
2606.19309v1,http://cll.niimm.ksu.ru/ontologies/mathematics#E1891,Equation,"S on $\mathbb T^2$ We prove norm inflation for the cubic hyperbolic nonlinear Schrödinger equation in $H^s(\mathbb T^2)$ for every $s\in(-\infty,0)\cup(0,\frac12]$. The scaling-critical point $s=0$ is exclude",MathEntRuler lexical concept match
2606.19309v1,http://cll.niimm.ksu.ru/ontologies/mathematics#E293,Point,"on in $H^s(\mathbb T^2)$ for every $s\in(-\infty,0)\cup(0,\frac12]$. The scaling-critical point $s=0$ is excluded by conservation of the $L^2$ norm. The strong ill-posedness below and above the scaling-cri",MathEntRuler lexical concept match
2606.19309v1,http://cll.niimm.ksu.ru/ontologies/mathematics#E1168,Line,"cubic hyperbolic NLS on $\mathbb T^2$ We prove norm inflation for the cubic hyperbolic nonlinear Schrödinger equation in $H^s(\mathbb T^2)$ for every $s\in(-\infty,0)\cup(0,\frac12]$. The scaling-critical",MathEntRuler lexical concept match
2606.19306v1,http://cll.niimm.ksu.ru/ontologies/mathematics#E847,Set,te distribution which appear to have been overlooked so far in the Bayesian nonparametric setting. The first is derived from a result in Aldous and Pitman (1998) for the conditional Brownian excursion pa,MathEntRuler lexical concept match
2606.19306v1,http://example.org/mathkg/Element,Element,"variables and can be easily generalized to provide the stick-breaking construction of any element, respectively, in a) the family of mixed Poisson-Kingman models driven by the $1/2$ stable Lévy measure and b",MathEntRuler lexical concept match
2606.19306v1,http://example.org/mathkg/Variable,Variable,"or. Both constructions are in terms of straightforward transformations of standard random variables and can be easily generalized to provide the stick-breaking construction of any element, respectively, in a)",MathEntRuler lexical concept match
2606.19298v1,http://cll.niimm.ksu.ru/ontologies/mathematics#E2114,Number,"of $1/e$ with $q\geq 3$, then, for the secretary problem with $q$ applicants, the optimal number of initially rejected applicants is $p$.",MathEntRuler lexical concept match
2606.19296v1,http://cll.niimm.ksu.ru/ontologies/mathematics#E1301,Operation,"The results show that partial control strategies are insufficient for efficient and safe operation, whereas simultaneous action of all three actuators stabilizes steam pressure, limits adverse thermal excursi",MathEntRuler lexical concept match
2606.19296v1,http://example.org/mathkg/Variable,Variable,"near steam-cycle representation, the coupled framework captures dynamic back-pressure and variable turbine enthalpy drop that are otherwise neglected, leading to different predictions of transient behavior an",MathEntRuler lexical concept match
2606.19296v1,http://cll.niimm.ksu.ru/ontologies/mathematics#E1891,Equation,"ollowing capability. In this study, we develop a hybrid dynamic framework that couples an equation-based model of the NuScale integral pressurized water reactor, including the reactor, primary loop, and movin",MathEntRuler lexical concept match
2606.19296v1,http://example.org/mathkg/Integral,Integral,"we develop a hybrid dynamic framework that couples an equation-based model of the NuScale integral pressurized water reactor, including the reactor, primary loop, and moving-boundary helical-coil once-through",MathEntRuler lexical concept match
2606.19296v1,http://example.org/mathkg/Limit,Limit,"operation, whereas simultaneous action of all three actuators stabilizes steam pressure, limits adverse thermal excursions in the primary loop and maintains acceptable steam generator operating margins du",MathEntRuler lexical concept match
2606.19296v1,http://cll.niimm.ksu.ru/ontologies/mathematics#E293,Point,"w interactions across the domain boundary. The integrated model reproduces nominal design-point conditions and is used to analyze a 5% step load rejection under five control strategies, including a decentr",MathEntRuler lexical concept match
2606.19296v1,http://cll.niimm.ksu.ru/ontologies/mathematics#E1168,Line,"generator operating margins during load-following maneuvers. Compared with a conventional linear steam-cycle representation, the coupled framework captures dynamic back-pressure and variable turbine entha",MathEntRuler lexical concept match
2606.19296v1,http://cll.niimm.ksu.ru/ontologies/mathematics#E2271,Ring,"cursions in the primary loop and maintains acceptable steam generator operating margins during load-following maneuvers. Compared with a conventional linear steam-cycle representation, the coupled framewo",MathEntRuler lexical concept match
2606.19289v1,http://example.org/mathkg/Equality,Equality,The Parabolic Harnack Inequality on Weighted Riemannian Manifolds We establish the parabolic Harnack inequality on weighted Riemannian manifol,MathEntRuler lexical concept match
2606.19289v1,http://cll.niimm.ksu.ru/ontologies/mathematics#E1202,Inequality,The Parabolic Harnack Inequality on Weighted Riemannian Manifolds We establish the parabolic Harnack inequality on weighted Riemannian manifol,MathEntRuler lexical concept match
2606.19288v1,http://cll.niimm.ksu.ru/ontologies/mathematics#E1505,Function,e prove local and global two weight estimates in which we bound difference quotients of a function in terms of certain weighted $L^p$ norms of its gradient.,MathEntRuler lexical concept match
2606.19288v1,http://cll.niimm.ksu.ru/ontologies/mathematics#E1700,Gradient,bound difference quotients of a function in terms of certain weighted $L^p$ norms of its gradient.,MathEntRuler lexical concept match
2606.19284v1,http://cll.niimm.ksu.ru/ontologies/mathematics#E847,Set,"trol actions. We propose a projected primal-dual algorithm where the true dual constraint sets are replaced by surrogate sets. Our main result is an upper bound on the mean-square tracking error, which d",MathEntRuler lexical concept match
2606.19284v1,http://cll.niimm.ksu.ru/ontologies/mathematics#E1301,Operation,nline feedback optimization (OFO) leverages real-time output measurements to optimize the operation of networked systems without requiring full knowledge of system dynamics or disturbances. We develop an OFO a,MathEntRuler lexical concept match
2606.19284v1,http://cll.niimm.ksu.ru/ontologies/mathematics#E1168,Line,ted Stochastic Gradient Descent with Decision Dependent Distributions: Extended Version Online feedback optimization (OFO) leverages real-time output measurements to optimize the operation of networked sy,MathEntRuler lexical concept match
2606.19284v1,http://example.org/mathkg/Mean,Mean,"constraint sets are replaced by surrogate sets. Our main result is an upper bound on the mean-square tracking error, which decomposes into four interpretable terms reflecting: (i) the stochasticity of th",MathEntRuler lexical concept match
2606.19284v1,http://cll.niimm.ksu.ru/ontologies/mathematics#E1700,Gradient,Projected Stochastic Gradient Descent with Decision Dependent Distributions: Extended Version Online feedback optimization (OFO) leverages,MathEntRuler lexical concept match
2606.19284v1,http://cll.niimm.ksu.ru/ontologies/mathematics#E2271,Ring,real-time output measurements to optimize the operation of networked systems without requiring full knowledge of system dynamics or disturbances. We develop an OFO approach for constrained stochastic opti,MathEntRuler lexical concept match
2606.19279v1,http://cll.niimm.ksu.ru/ontologies/mathematics#E1505,Function,egation structure on truth-values. NeSyCat has so far lacked an account of predicates and functions learned by neural networks. We provide NeSyCat Torch as the missing link and interpret computational symbols,MathEntRuler lexical concept match
2606.19279v1,http://cll.niimm.ksu.ru/ontologies/mathematics#E1315,Addition,"tation, monadic bind performs marginalisation, lazily pruning unneeded branches. On MNIST addition, our HaskTorch, JAX, and PyTorch implementations outperform LTN and DeepProbLog in speed and accuracy, while",MathEntRuler lexical concept match
2606.19279v1,http://cll.niimm.ksu.ru/ontologies/mathematics#E2410,Probability,"the monad; instantiating it with, e.g., the Giry monad extends the approach to continuous probability (working out a neural representation here is left for future work).",MathEntRuler lexical concept match
2606.19279v1,http://cll.niimm.ksu.ru/ontologies/mathematics#E2271,Ring,"r numerically stable, differentiable training: the lazy log-tensor monad over the log-semiring. For efficient training in batches, we furthermore employ a batch monad. The axioms are the source code: writ",MathEntRuler lexical concept match
2606.19278v1,http://cll.niimm.ksu.ru/ontologies/mathematics#E1301,Operation,Sequential Fair Allocation and Routing in Nonprofit Operations We study a dynamic fair sequential allocation problem in which a central planner distributes a divisible res,MathEntRuler lexical concept match
2606.19278v1,http://cll.niimm.ksu.ru/ontologies/mathematics#E2129,Coefficient,"policy and show that, under certain conditions, visiting locations in decreasing order of coefficient of variation (CV) of demand is optimal. Building on this insight, we propose a simple heuristic, PPA-deCV, wh",MathEntRuler lexical concept match
2606.19278v1,http://cll.niimm.ksu.ru/ontologies/mathematics#E1374,Join,"ef and food distribution, we incorporate routing decisions into the planner's problem and jointly optimize allocation and visitation order under two max-min fairness objectives, ex-post and forward. We fi",MathEntRuler lexical concept match
2606.19268v1,http://cll.niimm.ksu.ru/ontologies/mathematics#E847,Set,"al networks, in particular transformers. The inspiration for this comes from the HTSR and SETOL work of Martin, Mahoney and Hinrichs, combined with the TwoNN intrinsic dimension estimator of Facco et al.",MathEntRuler lexical concept match
2606.19268v1,http://cll.niimm.ksu.ru/ontologies/mathematics#E2106,Dimension,Patnaik-Pearson intrinsic dimension for internal representations of neural networks We define a new measure of intrinsic dimension of a data mani,MathEntRuler lexical concept match
2606.19268v1,http://cll.niimm.ksu.ru/ontologies/mathematics#E1349,Embedding,"to investigate first the Patnaik-Pearson dimension of the initial data manifold of token embeddings, and second the evolution of the Patnaik-Pearson dimension as token embeddings pass through the layers of th",MathEntRuler lexical concept match
2606.19260v1,http://cll.niimm.ksu.ru/ontologies/mathematics#E1505,Function,Dynamics of simply parabolic inner functions We study the dynamics of Polya-Szegö inner functions and discuss some of their basic properties such as equi,MathEntRuler lexical concept match
2606.19260v1,http://cll.niimm.ksu.ru/ontologies/mathematics#E1315,Addition,"establish the Orbit Counting Theorem up to a Cesàro average for Lavaurs semigroups. If we additionally assume that $F$ is a parabolic one component inner function, then the geodesic flow is mixing and the ful",MathEntRuler lexical concept match
2606.19260v1,http://cll.niimm.ksu.ru/ontologies/mathematics#E2145,Group,"We define a geodesic flow on the Riemann surface lamination associated to the Lavaurs semigroup and show that it is ergodic. As an application, we establish the Orbit Counting Theorem up to a Cesàro averag",MathEntRuler lexical concept match
2606.19260v1,http://cll.niimm.ksu.ru/ontologies/mathematics#E1368,Orbit,"to the Lavaurs semigroup and show that it is ergodic. As an application, we establish the Orbit Counting Theorem up to a Cesàro average for Lavaurs semigroups. If we additionally assume that $F$ is a parab",MathEntRuler lexical concept match
2606.19260v1,http://cll.niimm.ksu.ru/ontologies/mathematics#E1324,Map,"backward quotient half-cylinders, which allows one to enrich its dynamics with a Lavaurs map. To proceed, we restrict our attention to simply parabolic inner functions with finite Lyapunov exponent: $\i",MathEntRuler lexical concept match
2606.19260v1,http://cll.niimm.ksu.ru/ontologies/mathematics#E1741,Theorem,"semigroup and show that it is ergodic. As an application, we establish the Orbit Counting Theorem up to a Cesàro average for Lavaurs semigroups. If we additionally assume that $F$ is a parabolic one componen",MathEntRuler lexical concept match
2606.19250v1,http://cll.niimm.ksu.ru/ontologies/mathematics#E1891,Equation,"f the form $\partial_{x}(v^2)$. This latter term, just as in the case of the Benjamin-Ono equation, causes the system to become quasilinear and unsolvable via Picard iteration. We prove that eSBO is locally w",MathEntRuler lexical concept match
2606.19250v1,http://cll.niimm.ksu.ru/ontologies/mathematics#E1168,Line,"ell-posedness problem for the extended Schrödinger-Benjamin-Ono system (eSBO) on the real line. This system couples a Schrödinger field $u$ with a Benjamin-Ono type field $v$, including a term of the form",MathEntRuler lexical concept match
2606.19246v1,http://example.org/mathkg/Element,Element,"characteristic features of hyperbolic dynamics, such as the existence of infinitely many elements with fixed points.",MathEntRuler lexical concept match
2606.19246v1,http://cll.niimm.ksu.ru/ontologies/mathematics#E293,Point,"ures of hyperbolic dynamics, such as the existence of infinitely many elements with fixed points.",MathEntRuler lexical concept match
2606.19246v1,http://cll.niimm.ksu.ru/ontologies/mathematics#E1187,Angle,"se singular foliations, as well as a strong Markovian family, namely, a collection of rectangles serving as an analogue of a Markov partition for group actions. We prove that any such action is Anosov-like",MathEntRuler lexical concept match
2606.19246v1,http://cll.niimm.ksu.ru/ontologies/mathematics#E2145,Group,"ike actions by Thomas Barthelmé, Steven Frankel, and Kathryn Mann, in this paper we study group actions on the plane that preserve a pair of transverse singular foliations, as well as a strong Markovian fa",MathEntRuler lexical concept match
2606.19246v1,http://cll.niimm.ksu.ru/ontologies/mathematics#E1365,Group action,"ike actions by Thomas Barthelmé, Steven Frankel, and Kathryn Mann, in this paper we study group actions on the plane that preserve a pair of transverse singular foliations, as well as a strong Markovian family, n",MathEntRuler lexical concept match
2606.19244v1,http://cll.niimm.ksu.ru/ontologies/mathematics#E887,Graph,"cally introduce restricted Rota-Baxter Lie algebras of arbitrary weight with an intrinsic graph subalgebra characterization. We show that, via the splitting property, they give rise to restricted post-Lie",MathEntRuler lexical concept match
2606.19244v1,http://cll.niimm.ksu.ru/ontologies/mathematics#E2,Algebra,"On restricted Rota-Baxter Lie algebras of arbitrary weight Recently, Ehret and Gilliers introduced the notion of a (trivially) restricted post-Lie",MathEntRuler lexical concept match
2606.19244v1,http://cll.niimm.ksu.ru/ontologies/mathematics#E2271,Ring,"et and Gilliers introduced the notion of a (trivially) restricted post-Lie algebra, recovering the concepts of a restricted Lie algebra and a restricted pre-Lie algebra. In this paper, we specifically int",MathEntRuler lexical concept match
2606.19241v1,http://cll.niimm.ksu.ru/ontologies/mathematics#E1505,Function,"rves together with a non-zero differential form that is the differential of a meromorphic function. Furthermore, we consider the stack $\mathcal{M}_{g,n}^{ex, \mathbf{m}}$ that parametrizes those divisors on",MathEntRuler lexical concept match
2606.19241v1,http://cll.niimm.ksu.ru/ontologies/mathematics#E2106,Dimension,"ons of the objects that we consider, we show smoothness of these stacks and compute their dimension.",MathEntRuler lexical concept match
2606.19241v1,http://cll.niimm.ksu.ru/ontologies/mathematics#E1380,Deformation,"sors of exact differential forms. By introducing a local-global principle for first order deformations of the objects that we consider, we show smoothness of these stacks and compute their dimension.",MathEntRuler lexical concept match
2606.19234v1,http://cll.niimm.ksu.ru/ontologies/mathematics#E2,Algebra,n involving coloured partitions to prove classical freeness of the simple vertex operator algebras based on $\widehat{\mathfrak{sl}}_n$ at level $1$. These identities are used to produce Gröbner bases for th,MathEntRuler lexical concept match
2606.19225v1,http://cll.niimm.ksu.ru/ontologies/mathematics#E1505,Function,Disjointly universal inner functions We characterize when two sequences of composition operators admit disjointly universal Blaschke products and,MathEntRuler lexical concept match
2606.19225v1,http://example.org/mathkg/Derivative,Derivative,"cterizations we provide depend on geometric features of the symbols like their hyperbolic derivatives and pseudo hyperbolic distances. To achieve our results, we build a disjoint universality criterion for sequ",MathEntRuler lexical concept match
2606.19225v1,http://example.org/mathkg/Sequence,Sequence,Disjointly universal inner functions We characterize when two sequences of composition operators admit disjointly universal Blaschke products and singular inner functions. The char,MathEntRuler lexical concept match
2606.19225v1,http://cll.niimm.ksu.ru/ontologies/mathematics#E2145,Group,"sality criterion for sequences of maps that act on a metrizable, complete topological semigroup.",MathEntRuler lexical concept match
2606.19225v1,http://cll.niimm.ksu.ru/ontologies/mathematics#E2108,Distance,"geometric features of the symbols like their hyperbolic derivatives and pseudo hyperbolic distances. To achieve our results, we build a disjoint universality criterion for sequences of maps that act on a metr",MathEntRuler lexical concept match
2606.19225v1,http://cll.niimm.ksu.ru/ontologies/mathematics#E1320,Blaschke product,ns We characterize when two sequences of composition operators admit disjointly universal Blaschke products and singular inner functions. The characterizations we provide depend on geometric features of the symbols l,MathEntRuler lexical concept match
